{
  "id": "core.resource.001.face.default",
  "legacy": {
    "numericPrefix": 1,
    "variantTokens": ["face", "default"]
  },
  "mediaType": "image",
  "sourcePath": "resources/001_face.webp",
  "usage": ["portrait"],
  "characterRefs": ["core.character.001"],
  "hash": null,
  "metadata": {
    "author": "unknown",
    "license": "unknown"
  },
  "sourceTrace": {
    "sourceRootId": "eratw-content",
    "relativePath": "resources/001_face.webp",
    "legacyId": "001",
    "lineRange": null,
    "contentHash": null,
    "conversion": {
      "tool": "eratw-next-migration-draft",
      "version": "0.1.0",
      "confidence": "medium",
      "requiresReview": true
    }
  },
  "review": {
    "status": "needs_review",
    "notes": [],
    "blockingIssues": ["license_unknown"]
  }
}
